{
  "version": "1.0.0",
  "kind": "praxis.ai-provider-pricing-snapshot",
  "capturedAt": "2026-07-16",
  "currency": "USD",
  "unit": "per-million-tokens",
  "sourceUrl": "https://developers.openai.com/api/docs/pricing",
  "entries": [
    {
      "provider": "openai",
      "model": "gpt-5.4-mini",
      "modelPrefixes": ["gpt-5.4-mini-"],
      "serviceTier": "standard",
      "inputUsdPerMillion": 0.75,
      "cachedInputUsdPerMillion": 0.075,
      "outputUsdPerMillion": 4.5
    },
    {
      "provider": "openai",
      "model": "gpt-4.1-mini",
      "modelPrefixes": ["gpt-4.1-mini-"],
      "serviceTier": "standard",
      "inputUsdPerMillion": 0.4,
      "cachedInputUsdPerMillion": 0.1,
      "outputUsdPerMillion": 1.6
    },
    {
      "provider": "openai",
      "model": "gpt-5-mini",
      "modelPrefixes": ["gpt-5-mini-"],
      "serviceTier": "standard",
      "inputUsdPerMillion": 0.25,
      "cachedInputUsdPerMillion": 0.025,
      "outputUsdPerMillion": 2.0
    }
  ]
}
